{
  "$schema": "https://json-schema.org/draft/2020-12/schema",
  "$id": "https://aegisais.dev/contracts/Track.schema.json",
  "title": "Track",
  "type": "object",
  "additionalProperties": false,
  "required": [
    "id",
    "entityId",
    "layerId",
    "startTime",
    "endTime",
    "points",
    "confidence",
    "provenance",
    "access"
  ],
  "properties": {
    "id": { "type": "string" },
    "entityId": { "type": "string" },
    "layerId": { "type": "string" },
    "startTime": { "type": "string", "format": "date-time" },
    "endTime": { "type": "string", "format": "date-time" },
    "points": {
      "type": "array",
      "minItems": 1,
      "items": { "$ref": "_common.json#/$defs/GeoPoint" }
    },
    "confidence": { "$ref": "./Confidence.schema.json" },
    "provenance": { "$ref": "./Provenance.schema.json" },
    "access": { "$ref": "_common.json#/$defs/AccessMetadata" }
  }
}
